tweet_id_str,date_time,location,tweet_text,media_urls
1844092588506349768,Wed Oct 09 19:08:29 +0000 2024,India,"india lost ratan ! institution , remembered generations come. om shanti. rest peace #ratantata",
1844281344777724028,Thu Oct 10 07:38:32 +0000 2024,India,honour spending time man inspired gave believe making society better place calling. kind humans animals alike hope us follow shadow .. miss #ratantata,
1844294321736122741,Thu Oct 10 08:30:06 +0000 2024,India,om shanti ... #ratantata,
1843186838787526796,Mon Oct 07 07:09:21 +0000 2024,India,thank thinking,
1844230543921360910,Thu Oct 10 04:16:40 +0000 2024,India,true gem mother india ! #ratantata,
1844090170897059933,Wed Oct 09 18:58:52 +0000 2024,India,say gone .. ' hard bear loss .. hard .. farewell friend .. #ratantata,
1844078887871058378,Wed Oct 09 18:14:02 +0000 2024,India,bharat lost real ratan. end era om shanti #ratantata,
1844308391692489053,Thu Oct 10 09:26:00 +0000 2024,India,moving tribute #ratantata,
1844248936573260190,Thu Oct 10 05:29:45 +0000 2024,India,#ratantata #rip,
1844232129011708250,Thu Oct 10 04:22:58 +0000 2024,India,loving memory true legend #ratantata,
1844332801245708500,Thu Oct 10 11:03:00 +0000 2024,India,remembering fondly. #ratantata,
1844106732555075846,Wed Oct 09 20:04:41 +0000 2024,India,words fall short today. mr. ratan tata ' profound humanity selfless compassion shall always inspire us. forever remembered beloved mentor .,
1844102568877883473,Wed Oct 09 19:48:08 +0000 2024,India,"ratan tata ji personal hero mine , someone tried emulate throughout life. national treasure whose contributions nation building shall forever etched story modern india. true richness lay material wealth ethics , integrity , humility patriotism. immediate aftermath 2008 mumbai attacks , met staying iconic taj hotel. moment national crisis , titan stood tall became embodiment indian spirit , rebuild emerge stronger nation. profound condolences family , friends , tata group fellow indians",
1844183565568966762,Thu Oct 10 01:09:59 +0000 2024,India,"beloved son india done much beloved nation. mourning passing #ratantata , legend. om shanti .",
1844104557443629512,Wed Oct 09 19:56:02 +0000 2024,India,clock stopped ticking #ratantata,
1844189159876968623,Thu Oct 10 01:32:13 +0000 2024,India,"deepest condolences ' bharat ratna ' true sense , finest human , philanthropist business tycoon #ratantata more. contributions society nation enormous. thoughts prayers family friends hour grief irreplaceable irreparable loss. rest eternal peace. shanti",
1844322743099314411,Thu Oct 10 10:23:02 +0000 2024,India,#ratantata #ratantatasir,
1844098897591050338,Wed Oct 09 19:33:33 +0000 2024,India,"icon leadership , philanthropy , ethics ! ! legacy continue inspire generations. india lost giant today. #ripratantata #ratantata",
1844096172581072936,Wed Oct 09 19:22:43 +0000 2024,India,truly ratan nation #ratantata #marketingmind #rip,
1844250286728282122,Thu Oct 10 05:35:07 +0000 2024,India,miss true friend ! man military roots amp real entrepreneur spirit shaped india landscape ethical values leadership. truly left indelible legacy ! remembered man service #ratantata,
1844073929352290680,Wed Oct 09 17:54:20 +0000 2024,India,"hearing news ratan tata , whole country waking today ! ! ambani adani ever get madness ? single person entire country critical ratan tata ! india give government long alive ! prayers reach god , #ratantata sir may blessed life ! get well soon ratan tata sir #tatamotors #ratantata",
1844104562254512619,Wed Oct 09 19:56:04 +0000 2024,India,revenue tata group ratan tata took 5.7 billion. revenue tata group ratan tata retired 101.3 billion. difference great ordinary simply great think ordinary ordinary think great .,
1844242670174208192,Thu Oct 10 05:04:51 +0000 2024,India,rip legend #ratantata,
1844103641000763552,Wed Oct 09 19:52:24 +0000 2024,India,"sir ratan tata showed us true success measured lives touch. grateful inspiration , teaching us lead kindness. true legacies built leave behind thank everything , sir",
1844263790616936542,Thu Oct 10 06:28:47 +0000 2024,India,"ratan tata , personal hero loss ratan tata sir passing. loss feels personal me. hero growing , like many others. consider blessed gotten opportunity know personal hero deeply last decade. meeting interacting many times time , learning lessons life. relationship mr. tata started 2008. graduating iit bombay guest speaker convocation. young kid words day stayed serve one country. 2015 , got chance meet mr tata decided invest ola. interactions end there. begun ! mr tata like business leader ever met. took personal interest journey. every interaction grace , humility , curiosity world learning me. 2016 , invited come bengaluru address whole company. thought person stature would politely decline actually took full day , flew bengaluru spent entire day team company ! one story like share today key role founding second company ola electric. one day 2017 got call asking come mumbai. said bhavish want take somewhere show something exciting . flew plane coimbatore see personal project making electric vehicles tata nano ! passionate excited electric vehicles. even drove one test track pointed detailed improvements engineers. day ola electric really got started ignited passion evs cars ! , almost every product conceptualised designed yet released would go show concepts would patiently sit ideate give feedback. love animals dogs also grew me. fact , love dogs many times went office , would notice street dogs proudly sitting right next inside office ! inspiration , decided open ola offices factories stray dogs today almost 30 living facilities. last time met year ago share news ola electric ipo usual gracious curious. frail enthusiasm cars high ever , encouragement strong ever. reflect legacy today , set bar high us. walk journey , make mistakes learn , feel incredibly blessed seen amazing man close , gotten chance see ideal strive for. deeply miss him. india deeply miss him. one like again. om shanti",
1844082096111001606,Wed Oct 09 18:26:47 +0000 2024,India,"lost true ratan bharat , shri ratan tata ji. life inspiration us continue live hearts. om shanti",
1676133295015247875,Tue Jul 04 07:38:13 +0000 2023,India,"monsoons , lot stray cats dogs take shelter cars. important check car turn accelerate avoid injuries stray animals taking shelter. seriously injured , handicapped even killed unaware presence vehicles. would heartwarming could offer temporary shelter pouring season .",
1844093307439173962,Wed Oct 09 19:11:20 +0000 2024,India,"shri ratan tata ji legacy one compassion , statesmanship unshakeable conviction india growth story. life defined building enterprise giving back society. demise , people assam lost one biggest well wishers. shri tata , recipient assam ' highest civilian award , occupied special place hearts minds people assam. took giant leap faith welfare assam. deeply passionate improving healthcare state vision gave birth assam cancer care foundation. played instrumental role setting tata ' semiconductor facility jagiroad creating several employment opportunities youth. personal loss. every interaction left wiser , recent visited mumbai thank semiconductor project faith assam ' abilities industrial base. simplicity humility something never forget. death leaves huge void cannot filled. thoughts prayers members tata family nation mourns loss inspirational leader. om shanti !",
1844083251843039687,Wed Oct 09 18:31:23 +0000 2024,India,bharat mata lost one valuable son ! om shanti ! ! always missed ! #ratantata !,
1844362460213776852,Thu Oct 10 13:00:51 +0000 2024,India,proved world wrong #ratantata,
1844363324194165047,Thu Oct 10 13:04:17 +0000 2024,India,bill gates writes note ratan tata ..,
1844293934924939697,Thu Oct 10 08:28:34 +0000 2024,India,"rip ratan tata ji. legacy , values , work always undeniable source inspiration. condolences loved ones .",
1844103562055524640,Wed Oct 09 19:52:05 +0000 2024,India,"#ratantata world ' biggest donor. donated 829,734 crore. built multiple free hospitals , schools amp saved millions lives. today , death , whole world crying. unheard instances mr. tata make cry",
1844302483423932785,Thu Oct 10 09:02:32 +0000 2024,India,lot deservedly said said mr. tata ' greatness. must also spoken incredible sense humour. moment always special #ratantata,
1844393799528935737,Thu Oct 10 15:05:23 +0000 2024,India,ratan tata passes away rip #ratantata #ratantatasir #antimdarshan #ratantatapassedaway,
1844225943025422730,Thu Oct 10 03:58:23 +0000 2024,India,"life , demise , mr ratan tata moved nation. fortunate spend time , millions , never met , feel grief feel today. impact. love animals philanthropy , showed true progress achieved care means take care themselves. rest peace , mr tata. legacy continue live institutions built values embraced .",
1844329803236901228,Thu Oct 10 10:51:05 +0000 2024,India,man gave indians wheels .. begins final journey. #ratantata #ratantatasir #tatamotors,
1844317396108181820,Thu Oct 10 10:01:47 +0000 2024,India,# #ratantata,
1844091531919229411,Wed Oct 09 19:04:17 +0000 2024,India,. #ratantata #tata #rip #ripratantata #mumbai,
1844084321549942951,Wed Oct 09 18:35:38 +0000 2024,India,true bharat ratna om shanti #ratantata,
1446431109122650118,Fri Oct 08 11:03:44 +0000 2021,India,"welcome back , air india",
1844094065698275711,Wed Oct 09 19:14:21 +0000 2024,India,1500 ! om shanti #ratantata rip,
1844092004676067671,Wed Oct 09 19:06:10 +0000 2024,India,"6 days ago , #ratantata congratulated pm modi completion 10 years swachh bharat , om shanti .",
1844082581534539778,Wed Oct 09 18:28:43 +0000 2024,India,"shri ratan tata ji visionary business leader , compassionate soul extraordinary human being. provided stable leadership one india oldest prestigious business houses. time , contribution went far beyond boardroom. endeared several people thanks humility , kindness unwavering commitment making society better .",
1844221910890184973,Thu Oct 10 03:42:22 +0000 2024,India,ratan tata passes away 86. #ratantata,
1844078957106430352,Wed Oct 09 18:14:19 +0000 2024,India,ratan tata shri jrd tata #legends #rip,
1844081334190309407,Wed Oct 09 18:23:46 +0000 2024,India,"unable accept absence ratan tata. india economy stands cusp historic leap forward. ratan life work much position. hence , mentorship guidance point time would invaluable. gone , commit emulating example. businessman financial wealth success useful put service global community. goodbye godspeed , mr. forgotten. legends never die om shanti",
1844097705842442284,Wed Oct 09 19:28:49 +0000 2024,India,deeply saddened passing mr. ratan tata .,
1844322310431572230,Thu Oct 10 10:21:19 +0000 2024,India,ratan tata love dogs legendary. pet goa meeting last time #ratan #ratantata,
1844107588683825287,Wed Oct 09 20:08:05 +0000 2024,India,"moment etched heart forever flying hon ble sir mr. ratan tata nyc delhi changed life. humility , grace , values left profound impact me. asked picture end flight , went get , stopped said , captain , throne. ' earned it. came behind humble gesture solidified beliefs leadership. photo meant personal inspiration , today , feel compelled share dedicate gratitude , inspiring melancholy legend whose legacy live on. rest peace , mr. tata. legacy lives , heart hearts billions ' touched worldwide. #ratantata #rip",
1844316112072343987,Thu Oct 10 09:56:41 +0000 2024,India,"saddened hear passing ratan tata sir. unmatched vision , humility kindness continue inspire generations. heartfelt condolences tata family difficult time .",
1844080823303274539,Wed Oct 09 18:21:44 +0000 2024,India,r.i.p legend #ratantata,
1844729801208201529,Fri Oct 11 13:20:32 +0000 2024,India,rip ratan tata ji,
1844298157896900697,Thu Oct 10 08:45:20 +0000 2024,India,"memoriam mr. ratan naval tata , leader whose compassion vision live hearts millions .",
1844090726143123907,Wed Oct 09 19:01:05 +0000 2024,India,"autobiography , ratan sir shared would like remembered legacy #ratantata",
1844279774187040979,Thu Oct 10 07:32:17 +0000 2024,India,today .... whole nation cried ! #ratantata #ratantatasir #antimdarshan,
1844392983510319303,Thu Oct 10 15:02:09 +0000 2024,India,"varanasi , uttar pradesh tribute #ratantata held ganga aarti dashashwamedh ghat. thousands , including foreign tourists , participated lighting 51 lamps observing two minutes silence honour contributions legacy .",
1844369111708729408,Thu Oct 10 13:27:17 +0000 2024,India,#respect . sir ratan tata,
1559802112669728768,Wed Aug 17 07:19:38 +0000 2022,India,"man hurts see get old. still unstoppable , still smiling still thoughtful #ratantata",
1844204688905994466,Thu Oct 10 02:33:56 +0000 2024,India,heaven received precious soul today #ratantatapassedaway #ratantata #restinpeace #ratantatasir #,
1844247057256829116,Thu Oct 10 05:22:17 +0000 2024,India,three generations tatas shri jamsetji tata shri jrd tata shri ratan tata #legends #india,
1844595071376818577,Fri Oct 11 04:25:10 +0000 2024,India,"#ratantata world ' biggest donor. donated 829,734 crore. built multiple free hospitals , schools saved millions lives. death , whole world crying. unheard instances mr. tata make cry",
1844059013325128104,Wed Oct 09 16:55:04 +0000 2024,India,rip ratan tata sir #ratantata,
1844055099699790125,Wed Oct 09 16:39:31 +0000 2024,India,#ratantata cheated millions indians 3rd class cars,
1845122690677604560,Sat Oct 12 15:21:44 +0000 2024,India,? #ratantata,
1844423298937127124,Thu Oct 10 17:02:36 +0000 2024,India,even thor farewell ratan tata sir ! captured #mumbairains,
1844247330108891322,Thu Oct 10 05:23:22 +0000 2024,India,"ratan tata passes sway. leadership , 150 year old business group truly marked way 21st century tata brand resonated legacy world. tata group foundation lies firm neutrality inclusive culture hallmark ratan tata. genius jrd tata mantle passed onto ratan tata. independence , jrd fight lot battles licence raj malpractices government decision nationalise air india. achieved maintaining high ethical standards. fortunately , entry ratan tata happened malpractices mend licence raj getting obliterated rising spirit liberalisation. shackles evils slowly dissipating however , indian industries still reeling aftermath transitional phase. ratan tata , astute observer world happenings global perspective knew globalisation would affect indian minds aware indian sharp acumen capable coping global market. keeping mind , right products like coffee , watches , world reknowned company tcs , british pride jaguar land rover gracefully taken expertise. unparalleled visionary , extended arms achieve every man dream home housing schemes making affordable car nano within reach every indian. amidst , one never saw getting stuck petty happenings. rising hurdles achieving trademark. fortunate personal close equation ratan tata. never happened put proposal refused. presented blue print maharashtra development , chalked important suggestions , spontaneous assistance csr funds maharashtra navnirman sena nashik botanical garden affection towards party always cherished. botanical garden made nashik result painstaking effort perseverance part. ratan tata witness though initial funds released adequate , graciously sanctioned keeping sincerity efforts magnitude work happening. completion , made personal visit botanical garden. another aspect ratan tata heartwarming resonates love dogs. stray dogs looked welcomed premises , taj mahal hotel office head quarters. love dogs transcends persona level beyond words. ratan tata felicitated buckingham palace unmatched philanthropy. however , last moment , pet dog took ill. immediately called prince charles conveyed regrets leave ailing dog alone. highlights remarkable human was. today , feel sense deep grief lost senior dear friend country lost national icon. irreparable loss. behalf maharashtra navnirman sena cherished memories , heartfelt homage ratan tata raj thackeray",
1844210647413764177,Thu Oct 10 02:57:36 +0000 2024,India,man inspired touched many lives .. thank #ratantata sir miss rip,
1844093098974216221,Wed Oct 09 19:10:31 +0000 2024,India,shri #ratantata ji remembered ever sir .. thank inspiration true legend .. true icon,
1844271878061555737,Thu Oct 10 07:00:55 +0000 2024,India,deeply saddened hear passing shri ratan tata ji. heartfelt condolences family loved ones .,
1844089719073931464,Wed Oct 09 18:57:05 +0000 2024,India,official statement tata group ! #ratantata,
1844246317410943084,Thu Oct 10 05:19:21 +0000 2024,India,"visionary , icon , kind soul. rip ratan tata ji , legacy inspire young people across country beyond .",
1844086183909044622,Wed Oct 09 18:43:02 +0000 2024,India,"deeply saddened passing shri ratan tata ji , visionary leader whose contributions shaped india ' industrial growth. legacy integrity , philanthropy , innovation continue inspire generations. may soul rest peace om shanti india lost one valuable son ! #ripratantata #ratantata",
1844654286011031661,Fri Oct 11 08:20:28 +0000 2024,India,1st picture marine drive india world cup 2nd picture marine drive convoy hearse carrying shri ratan tata body passing sorry say mumbai deserve anmol ratan,
1844658422999900381,Fri Oct 11 08:36:54 +0000 2024,India,", ? #ratantata #tatagroup #tatasons #tatatrust #tata #noeltata",
1844057652898431099,Wed Oct 09 16:49:40 +0000 2024,India,"really hope ' true ' viral screenshot , ? ? #ratantata",
1844174780997743063,Thu Oct 10 00:35:05 +0000 2024,India,#ratantatapassedaway #ratantata,
1844559188933955791,Fri Oct 11 02:02:35 +0000 2024,India,#ratantata,
1844296598492414464,Thu Oct 10 08:39:09 +0000 2024,India,remembering ratan tata. occasion conferment honorary citizenship singapore .,
1844093017617220050,Wed Oct 09 19:10:11 +0000 2024,India,anand mahindra tweets legend ! #ratantata,
1843254166732632175,Mon Oct 07 11:36:54 +0000 2024,India,", #ratantatahealth #ratantata",
1844086639339122853,Wed Oct 09 18:44:50 +0000 2024,India,titan #ratantata,
1844350973302669688,Thu Oct 10 12:15:13 +0000 2024,India,great great great great wonderful man shri ratan tata g #ratantatasir,
1844082183176323559,Wed Oct 09 18:27:08 +0000 2024,India,"legend , man inspiration , business hero rip #ratantata",
1844263277389545899,Thu Oct 10 06:26:44 +0000 2024,India,rest peace sir #ratantata,
1844088072964805045,Wed Oct 09 18:50:32 +0000 2024,India,inspiration generations #ratantata,
1844088700088770832,Wed Oct 09 18:53:02 +0000 2024,India,#ratantata,
1844285919781847436,Thu Oct 10 07:56:43 +0000 2024,India,"deeply saddened passing ratan tata , visionary leader , philanthropist , former president iisc ' court. condolence meeting held today institute pay respects .",
1844088218297524440,Wed Oct 09 18:51:07 +0000 2024,India,"deeply saddened passing away thiru. #ratantata , true titan indian industry beacon humility compassion. visionary leadership shaped tata group also set global benchmark ethical business practices. relentless dedication nation building , innovation , philanthropy left indelible mark millions lives. india lost giant , legacy continue inspire generations. offer deepest condolences family , colleagues , entire tata group profound moment loss .",
1844318066999796195,Thu Oct 10 10:04:27 +0000 2024,India,true gem mother india ! tribute india ratan passing #ratantata end era. prayers,
1844226356617330934,Thu Oct 10 04:00:02 +0000 2024,India,"#rip #ratantata know , architecture student cornell us , young ratan tata washed aeroplanes local flying club gain flying hours ? #rip #legend #ratantatasir #indiaremembers #tatagroup rip ratan tata , tata , india remembers",
1844279439020216665,Thu Oct 10 07:30:57 +0000 2024,India,"statement bharti enterprises founder amp chairman , sunil bharti mittal shri ratan tata demise .",
1844997616905355452,Sat Oct 12 07:04:44 +0000 2024,India,things men pasandida mard,
1844404736155406374,Thu Oct 10 15:48:51 +0000 2024,India,"honourable prime minister , shri. narendra modiji , jai maharashtra , veteran industrialist ratan tata , shaped indian industry last three decades , passed away. knew shri ratan tata closely would gathered person least interested honours accolades. contributions indian industry economy immense. importantly , humanity true greatness. person received bharat ratna , highest civilian honour , lifetime. party request hope declared bharat ratna posthumously. sure indians expectation. news ratan tata ' death came yesterday , people voluntarily paused programs paid tribute. venues mumbai even dandiya stopped midway , two minute silence observed. since morning , everyone india pouring tributes social media. someone home departed. personalities ' bharat ratna ' ? therefore , sure take decision regard instruct concerned. india veritable mine gems. bestowing civil honour take place appropriate stage lives. never anyone request posthumous honour anyone. honouring someone life , hale hearty , better. often see eminent people receiving honour state physical disrepair , right. sure institute definite policy regard. raj thackeray .",
1844078969181913252,Wed Oct 09 18:14:22 +0000 2024,India,man zero haters #ratantata,
1844781511276450055,Fri Oct 11 16:46:01 +0000 2024,India,french president macron condoles demise shri ratan tata,
1844418312484290666,Thu Oct 10 16:42:47 +0000 2024,India,". sue warm kind hearted know ratan tata sir someone really admired , business sense kindness , passion amp nature wise , think took inspiration businessman , money putting heart business",
1844080031578067227,Wed Oct 09 18:18:35 +0000 2024,India,greatest indian entrepreneur ever. sir ratan tata really built india ' trusted brands. always hero. rest peace,
1844700421136302158,Fri Oct 11 11:23:47 +0000 2024,India,srk left hasnt posted sir ratan tata anywhere,
1844293854142529707,Thu Oct 10 08:28:14 +0000 2024,India,"titan clocks stopped today. #ratantata , visionary steered tata sons global powerhouse , passed away 86. end era. rest power",
1614637875269894145,Sun Jan 15 14:57:22 +0000 2023,India,"day , 25 years ago , indica unveiled. india first truly indigenous car laid foundation tata motors car biz. pragati maidan jan 15th , 1998 amp today honoured celebrate 25th anniv ratan tata man behind legendary car .",
1844089075197747269,Wed Oct 09 18:54:31 +0000 2024,India,"rip ratan tata ! first indian brand leo messi became ambassador tata motors. kid , still remember big deal see global football icon like messi face indian automobile manufacturer. back , leo said , excited first association indian brand extremely thrilled part tata motors family. always fascinated india heard great things diverse country. tata motors true representation india well established brand , globally. important believe keep pushing achieve success first campaign stands .",
1352126362698575872,Thu Jan 21 05:30:20 +0000 2021,India,thank mr #tata mentor amp guide us past 6 years. learnt much you. always motivated right things always think others myself. #ratantata #lifelessons #life #mi,
1844787833535385771,Fri Oct 11 17:11:08 +0000 2024,India,#ratantata,
1844293240729764029,Thu Oct 10 08:25:48 +0000 2024,India,"titan clocks stopped today. #ratantata , visionary steered tata sons global powerhouse , passed away 86. end era. rest power",
1676511483293999104,Wed Jul 05 08:41:00 +0000 2023,India,#ratantata #animallovers #monsoon2023 #news7tamil,
1844155652815585420,Wed Oct 09 23:19:05 +0000 2024,India,"never underestimate power kindness , empathy , compassion interactions others. ratan tata",
1844225721348259925,Thu Oct 10 03:57:30 +0000 2024,India,good fortune meeting spending time legend called rnt fond memories last decade. truly missed sir #ratantata,
1483761998370598921,Wed Jan 19 11:23:22 +0000 2022,India,"know ratan tata ' younger brother jimmy tata lives quiet reticent life humble 2 bhk flat colaba , mumbai ! never interested business , good squash player would beat every time. low profile like tata group !",
1844728333520802191,Fri Oct 11 13:14:42 +0000 2024,India,"weekend vibes slow success builds character , fast success builds ego. ratan tata #words wisdom #life good",
1845110230318772580,Sat Oct 12 14:32:14 +0000 2024,India,"let every youngster know gem person ratan tata sir was. life testament integrity , humility , selfless dedication. titan india rest peace legend #ratantata #india #everythingisknowledge",
1844086834927894864,Wed Oct 09 18:45:37 +0000 2024,India,truly ratan world #ratantata,
1844097372072313135,Wed Oct 09 19:27:29 +0000 2024,India,"mourn loss #ratantata , visionary leader former chairman emeritus tata sons , passed away 86 mumbai. remarkable leadership transformed tata group global powerhouse , legacy inspire generations come. rip sir #endofanera",
1844095435344171139,Wed Oct 09 19:19:48 +0000 2024,India,tribute legend ! #ratantata,
1844081902141177996,Wed Oct 09 18:26:01 +0000 2024,India,rest peace #ratantata sir,
1844092142978990214,Wed Oct 09 19:06:43 +0000 2024,India,much hurting #ratantata,
1844081070565978604,Wed Oct 09 18:22:43 +0000 2024,India,bye king om shanti #ratantata sir,
1845115347646480460,Sat Oct 12 14:52:34 +0000 2024,India,#ratantata,
1474618447988346881,Sat Dec 25 05:50:09 +0000 2021,India,,
1844267757791224011,Thu Oct 10 06:44:32 +0000 2024,India,"shantanu naidu navigating heartache losing mentor close friend , ratan tata #ratantata #tata #rip #shantanunaidu #pinkvilla",
1844086334102831598,Wed Oct 09 18:43:38 +0000 2024,India,". #ratantata , ,",
1844093258244424021,Wed Oct 09 19:11:09 +0000 2024,India,"visionary built businesses dreams. legacy continue inspire generations lead compassion , courage , unwavering integrity ! rest peace , ratan tata !",
1844701079000248465,Fri Oct 11 11:26:24 +0000 2024,India,"sushant singh rajput died , remained silent. rohit sharma virat kohli declare retirement , remained silent. ratan tata passed away , remained silent. dholak played ambani ' house , danced wearing ghunghru. right wrong ? ?",
